{
  "schema_version": "0.1.0",
  "artifact_type": "route-log",
  "route_log_id": "route-log-20260314-demo-0001",
  "run_id": "run-20260314-demo-0001",
  "project": "server-market-deterministic-agentic-model",
  "entries": [
    {
      "route_log_entry_id": "route-log-entry-0001",
      "event_timestamp": "2026-03-14T12:00:00Z",
      "task_class": "acquisition",
      "assigned_platform": "perplexity-pro",
      "assigned_environment": "track-a-manual",
      "assigned_role": "acquisition",
      "route_action": "route_assigned",
      "route_reason": "Citation-first acquisition route selected for primary evidence gathering.",
      "overlap_targets": ["chatgpt-plus"],
      "notes": "Minimal example route entry."
    }
  ],
  "notes": "Example route log.",
  "review_state": "not_reviewed",
  "unresolved_items": []
}
